{
  "name": "A4_All4mer_1hr_launchChem",
  "updatedAt": "2015-11-18T12:24:35.413-08:00",
  "path": "/pbi/dept/secondary/siv/smrtlink/smrtlink-beta/smrtsuite_166987/userdata/jobs_root/000/000038",
  "state": "SUCCESSFUL",
  "uuid": "ea3c0962-f37b-43b6-82b3-051d41dc82c0",
  "jobTypeId": "pbsmrtpipe",
  "id": 38,
  "comment": "pbsmrtpipe pbsmrtpipe.pipelines.sa3_ds_resequencing PbSmrtPipeJobOptions(pbsmrtpipe.pipelines.sa3_ds_resequencing,List(BoundEntryPoint(eid_subread,/pbi/collections/313/3130022/r54004_20151117_231855/1_A01/m54004_151117_231902.subreadset.xml), BoundEntryPoint(eid_ref_dataset,/pbi/dept/secondary/siv/smrtlink/smrtlink-beta/smrtsuite_166987/userdata/jobs_root/000/000008/pacbio-reference/All4mer_V2_44_circular_72x_l50256/referenceset.xml)),List(PipelineStrOption(genomic_consensus.task_options.algorithm,Name genomic_consensus.task_options.algorithm,quiver,Description genomic_consensus.task_options.algorithm), PipelineStrOption(genomic_consensus.task_options.diploid,Name genomic_consensus.task_options.diploid,false,Description genomic_consensus.task_options.diploid), PipelineStrOption(genomic_consensus.task_options.min_confidence,Name genomic_consensus.task_options.min_confidence,40,Description genomic_consensus.task_options.min_confidence), PipelineStrOption(genomic_consensus.task_options.min_coverage,Name genomic_consensus.task_options.min_coverage,5,Description genomic_consensus.task_options.min_coverage), PipelineStrOption(pbalign.task_options.algorithm_options,Name pbalign.task_options.algorithm_options,-minMatch 12 -bestn 10 -minPctIdentity 70.0,Description pbalign.task_options.algorithm_options), PipelineStrOption(pbalign.task_options.concordant,Name pbalign.task_options.concordant,true,Description pbalign.task_options.concordant), PipelineStrOption(pbalign.task_options.consolidate_aligned_bam,Name pbalign.task_options.consolidate_aligned_bam,false,Description pbalign.task_options.consolidate_aligned_bam), PipelineStrOption(pbalign.task_options.consolidate_n_files,Name pbalign.task_options.consolidate_n_files,1,Description pbalign.task_options.consolidate_n_files), PipelineStrOption(pbalign.task_options.hit_policy,Name pbalign.task_options.hit_policy,randombest,Description pbalign.task_options.hit_policy), PipelineStrOption(pbalign.task_options.min_accuracy,Name pbalign.task_options.min_accuracy,70.0,Description pbalign.task_options.min_accuracy), PipelineStrOption(pbalign.task_options.min_length,Name pbalign.task_options.min_length,50,Description pbalign.task_options.min_length)),List(PipelineBooleanOption(pbsmrtpipe.options.debug_mode,pbsmrtpipe DEBUG Mode,false,Enable pbsmrtpipe DEBUG Mode to pbsmrtpipe.log and master.log), PipelineIntOption(pbsmrtpipe.options.max_nproc,Max Number of Processors per Task,24,Max Number of Processors), PipelineStrOption(pbsmrtpipe.options.tmp_dir,Tmp directory,/pbi/dept/secondary/siv/smrtlink/smrtlink-beta/smrtsuite_166987/userdata/tmp_dir,Root location to temp directory), PipelineBooleanOption(pbsmrtpipe.options.chunk_mode,Enable chunk mode,true,Enable chunk mode to create chunk.json from registered chunkable tasks), PipelineIntOption(pbsmrtpipe.options.max_total_nproc,Max Total Number of processors to use per pipeline execution,1000,Total Max Number of slots/proc to use), PipelineIntOption(pbsmrtpipe.options.max_nchunks,Max Number of Chunks per Task,24,Max Number of Chunks per task), PipelineBooleanOption(pbsmrtpipe.options.distributed_mode,Enable Distributed mode,true,Enable Distributed mode to submit jobs to the cluster resources. CLUSTER_MANAGER_TMPL_DIR must be set), PipelineBooleanOption(pbsmrtpipe.options.exit_on_failure,Enable Exit on Failure,false,Exit on the first failed task.), PipelineStrOption(pbsmrtpipe.options.cluster_manager,Cluster Template Directory,/pbi/dept/secondary/siv/smrtlink/smrtlink-beta/smrtsuite_166987/userdata/generated/config/jms_templates,Directory of Cluster templates (must contain start.tmpl and stop.tmpl) or python module path (e.g, pbsmrtpipe.my_module.sge), PipelineIntOption(pbsmrtpipe.options.max_nworkers,Max Number of Workers,100,Max Number of concurrently running tasks. (Note:  max_nproc will restrict the number of workers if max_nworkers * max_nproc > max_total_nproc))),,Some(http://smrtlink-beta.nanofluidics.com:8081/secondary-analysis/job-manager/jobs/pbsmrtpipe/ea3c0962-f37b-43b6-82b3-051d41dc82c0),None)",
  "createdAt": "2015-11-18T12:24:35.413-08:00",
  "jsonSettings": "{\"name\":\"A4_All4mer_1hr_launchChem\",\"entryPoints\":[{\"entryId\":\"eid_subread\",\"fileTypeId\":\"PacBio.DataSet.SubreadSet\",\"datasetId\":38},{\"entryId\":\"eid_ref_dataset\",\"fileTypeId\":\"PacBio.DataSet.ReferenceSet\",\"datasetId\":12}],\"workflowOptions\":[],\"taskOptions\":[{\"optionId\":\"genomic_consensus.task_options.algorithm\",\"value\":\"quiver\",\"optionTypeId\":\"pbsmrtpipe.option_types.string\"},{\"optionId\":\"genomic_consensus.task_options.diploid\",\"value\":false,\"optionTypeId\":\"pbsmrtpipe.option_types.boolean\"},{\"optionId\":\"genomic_consensus.task_options.min_confidence\",\"value\":40,\"optionTypeId\":\"pbsmrtpipe.option_types.integer\"},{\"optionId\":\"genomic_consensus.task_options.min_coverage\",\"value\":5,\"optionTypeId\":\"pbsmrtpipe.option_types.integer\"},{\"optionId\":\"pbalign.task_options.algorithm_options\",\"value\":\"-minMatch 12 -bestn 10 -minPctIdentity 70.0\",\"optionTypeId\":\"pbsmrtpipe.option_types.string\"},{\"optionId\":\"pbalign.task_options.concordant\",\"value\":true,\"optionTypeId\":\"pbsmrtpipe.option_types.boolean\"},{\"optionId\":\"pbalign.task_options.consolidate_aligned_bam\",\"value\":false,\"optionTypeId\":\"pbsmrtpipe.option_types.boolean\"},{\"optionId\":\"pbalign.task_options.consolidate_n_files\",\"value\":1,\"optionTypeId\":\"pbsmrtpipe.option_types.integer\"},{\"optionId\":\"pbalign.task_options.hit_policy\",\"value\":\"randombest\",\"optionTypeId\":\"pbsmrtpipe.option_types.string\"},{\"optionId\":\"pbalign.task_options.min_accuracy\",\"value\":70.0,\"optionTypeId\":\"pbsmrtpipe.option_types.float\"},{\"optionId\":\"pbalign.task_options.min_length\",\"value\":50,\"optionTypeId\":\"pbsmrtpipe.option_types.integer\"}],\"pipelineId\":\"pbsmrtpipe.pipelines.sa3_ds_resequencing\"}"
}