{
	"name" : "Job merge-datasets",
	"updatedAt" : "2016-02-23T09:41:34.741-08:00",
	"path" : "",
	"state" : "CREATED",
	"uuid" : "b8fb1138-4a00-4baf-a754-fc37492d5f00",
	"jobTypeId" : "merge-datasets",
	"id" : 131,
	"comment" : "Merging Datasets MergeDataSetOptions(PacBio.DataSet.SubreadSet,List(/pbi/dept/secondary/siv/testdata/SA3-DS/lambda/2372215/0007_tiny/Analysis_Results/m150404_101626_42267_c100807920800000001823174110291514_s1_p0.all.subreadset.xml, /mnt/appslab/projects/2015/starfish_hlac/ccs2/histo_DPB1_96pool_10fmol_reheader.subreadset.xml),mergedSubreadDataset)",
	"createdAt" : "2016-02-23T09:41:34.741-08:00",
	"jsonSettings" : "{\"datasetType\":\"PacBio.DataSet.SubreadSet\",\"paths\":[\"/pbi/dept/secondary/siv/testdata/SA3-DS/lambda/2372215/0007_tiny/Analysis_Results/m150404_101626_42267_c100807920800000001823174110291514_s1_p0.all.subreadset.xml\",\"/mnt/appslab/projects/2015/starfish_hlac/ccs2/histo_DPB1_96pool_10fmol_reheader.subreadset.xml\"],\"name\":\"mergedSubreadDataset\"}"
}