{
	"name" : "Job convert-fasta-reference",
	"updatedAt" : "2016-02-23T10:38:46.799-08:00",
	"path" : "",
	"state" : "CREATED",
	"uuid" : "78ab0501-cbc8-4b99-9869-952f2a250ba9",
	"jobTypeId" : "convert-fasta-reference",
	"id" : 133,
	"comment" : "Import/Convert Fasta File to DataSet ConvertImportFastaOptions(/pbi/analysis/smrtportal/alpha/userdata/references/lambda/sequence/lambda.fasta.fai,my-lambda-reference,haploid,lambda)",
	"createdAt" : "2016-02-23T10:38:46.799-08:00",
	"jsonSettings" : "{\"path\":\"/pbi/analysis/smrtportal/alpha/userdata/references/lambda/sequence/lambda.fasta.fai\",\"name\":\"my-lambda-reference\",\"ploidy\":\"haploid\",\"organism\":\"lambda\"}"
}